,comment,unix_timestamp,created_utc,polarity score,negative score,neutral score,positive score,Comment Score
283,"**""We will never sell 1 single Doge ever.""**

-Mark Cuban, DogeCoin enthusiast / Owner NBA Dallas Mavericks",1619458229.0,2021-04-26 17:30:29,0.3612,0.0,0.865,0.135,Positive
284,"I don't see how I can lose money

\- When it goes UP, I profit

\- When it goes DOWN, I buy more so I can profit even more when it goes UP again.

Sometimes the simplest strategy its the best.

I like to remember myself that no one has yet lost money by holding DOGE, and we are not even close to what we can become.

EDIT: As I'm not putting money I will need anytime soon and can even see it at 99% down.

I trully believe at Dogecoin, just look the size of our subreddit (1.6m), its DOUBLE than r/ethereum  (816k) and more than half of r/bitcoin (2.8m).

DOGE its not unlimited as some people think, it has a decreasing annual-cap, today at 3,9% (Less than BTC at the same age 8yo).

Of course the hype will not be always UP and we will not be always at the news, but we have a solid community that can hold us during calm waters, and eventually we will see anothers bull runs.

Today you may call me crazy, but I'll HOLD my doges till $100.I don't trade, I just buy more with any money I have that I will not miss  


EDIT2: I believe DOGE its the only coin today with real chance of becoming mainstream at the future. People like to compare BTC with Gold, how many people you know that buy groceries with gold? Thats it. We need this much coins that DOGE has, today it may seems like a lot, but its so everybody can have a slice, and it won't affect the price of the coin, that I believe will surprass ETH current price (2k)",1619464243.0,2021-04-26 19:10:43,0.9287,0.027,0.893,0.08,Positive
285,I hope the whole SNL thing doesn’t turn out like dogeday. The problem is we already have a great base but on days when we have a massive event no one buys. People just expect to wake up and it’ll be $1. We need to create a real movement like GameStop and stop expecting for things to magically happen,1619437769.0,2021-04-26 11:49:29,0.5719,0.106,0.722,0.172,Positive
286,"For those that haven't yet watched it, ""Upshod"" on youtube really is quite good for dogecoin information and analysis.

* Remarkably free of hype
* Clear and well reasoned, insightful
* Distinguishes between fact and speculation

Anyone know of other solid, non-hype sources of information/analysis on youtube?  Seems to be in short supply...",1619449770.0,2021-04-26 15:09:30,0.9072,0.0,0.782,0.218,Positive
287,"So I called it.....last night was boring and very little excitement. Thats why I went to bed early, woke up....and was glad I didn't stay up watching the graph as I knew the trends proved.....it to be boring. Its in a HOLD pattern for sure. No one should be selling thats for damn sure. Even a cent or two drop won't warrant or justify anyone selling with the bullish pattern that we have. 

Sell if you need to feed your family, (but then, probably shouldn't be investing anyway), but thats it.

Go get some work done today, glance at it every so often, but no need to be glued to your phone, tablet, computer today for sure. 

And by the way, if ANYONE refers to the WHALES as actual PEOPLE......im gonna slap ya.",1619450866.0,2021-04-26 15:27:46,0.1894,0.079,0.836,0.085,Positive
288,200 Dogecoins acquired let's go 🚀,1619453348.0,2021-04-26 16:09:08,0.0,0.0,1.0,0.0,Neutral
289,Guys just chill and let the long haul set in. It hasn't been over night and wont be cor a while. Just hodl and enjoy the ride we will get to the moon eventually. Just keep buying when you can and stop freaking out. DOGE Army!,1619454819.0,2021-04-26 16:33:39,-0.2714,0.103,0.835,0.062,Negative
290,"Bought 4k at .08

I'm just glad to be here 😊",1619454951.0,2021-04-26 16:35:51,0.8402,0.0,0.571,0.429,Positive
291,"I would like to announce that once Doge surpasses $1, I'm going to rescue a Shiba Inu  🐕🐕  & spoil them with love",1619455714.0,2021-04-26 16:48:34,0.875,0.0,0.677,0.323,Positive
292,I love that I’m part of this awesome community 🚀🚀🚀going to hold for about 5 yrs and se where we are at 💎💎💎🙌🏻 here!!! 💪💪,1619457754.0,2021-04-26 17:22:34,0.899,0.0,0.792,0.208,Positive
293,"Yesterday wiped me out. Sleeping through those dips, then mis-timing 2 other dips. Im only buying obvious dips today. For example, if I see it's .26500, like right now, then I will wait for it to be .2599 because I know that fking whale is lurking out there to strike any moment..",1619432215.0,2021-04-26 10:16:55,0.128,0.055,0.899,0.046,Positive
294,Crypto seems to be bouncing back today. Glad I dumped a couple hundred into BTC and DOGE,1619432696.0,2021-04-26 10:24:56,0.0772,0.13,0.725,0.145,Positive
295,Pump Monday! Let’s go lol,1619432914.0,2021-04-26 10:28:34,0.4753,0.0,0.564,0.436,Positive
296,Stop nagging about Musk.... yeeez,1619436666.0,2021-04-26 11:31:06,-0.5994,0.62,0.38,0.0,Negative
297,I'm in the green and holding 1k as of now. Happy to watch the candles go up and down cause ppl can buy cheap. In the dips and sell some gain when it's high. Told my bf im gonna buy a Shiba inu if u get rich lol,1619437308.0,2021-04-26 11:41:48,0.926,0.0,0.765,0.235,Positive
298,Imagine thinking you wont get rich off doge. Early adopters will be flying high in a few years.,1619437605.0,2021-04-26 11:46:45,-0.4449,0.147,0.853,0.0,Negative
299,Where is Dolly Parton when we need her?,1619437630.0,2021-04-26 11:47:10,0.0,0.0,1.0,0.0,Neutral
300,Diamond 💎paws 🐾! Or you’ll missed the rocket to the moon,1619440603.0,2021-04-26 12:36:43,0.126,0.138,0.692,0.169,Positive
301,"I told my wife i keep trying to swipe sell, and it wont. Diamond doesn't work on phone screens.",1619441023.0,2021-04-26 12:43:43,-0.2584,0.102,0.898,0.0,Negative
302,We have Lift-Off!,1619441053.0,2021-04-26 12:44:13,0.0,0.0,1.0,0.0,Neutral
303,New guy here. Watching doge go to the moon this morning!!!,1619441505.0,2021-04-26 12:51:45,0.0,0.0,1.0,0.0,Neutral
304,"Its very satisfying watching the signatures on this petition for Amazon to accept doge constantly going up.

[https://www.change.org/p/jeff-bezos-doge4amazon-accept-dogecoin-as-a-payment-method](https://www.change.org/p/jeff-bezos-doge4amazon-accept-dogecoin-as-a-payment-method)",1619441510.0,2021-04-26 12:51:50,0.7645,0.0,0.664,0.336,Positive
305,28cents and climbing 🎉🎉,1619441564.0,2021-04-26 12:52:44,0.6597,0.0,0.481,0.519,Positive
306,just hit 0.28. Let's keep going up,1619441592.0,2021-04-26 12:53:12,0.0,0.0,1.0,0.0,Neutral
307,Doge too strong 🥶💎,1619441677.0,2021-04-26 12:54:37,0.5106,0.0,0.645,0.355,Positive
308,Can anyone tell us if they're a lot of sell offs at .28??,1619441835.0,2021-04-26 12:57:15,0.0,0.0,1.0,0.0,Neutral
309,"#DiamondPaws!

Look at all these concerned the price is going too high for them to buy back and shilling their coins.

To newcomers: put into any crypto an amount you can afford having locked for a potentially long time. Differentiate, e.g. 33/33/33 in btc/eth/doge if you want lower risk. All cryptos are at high values now because this is still a bull market.",1619442190.0,2021-04-26 13:03:10,-0.1511,0.068,0.873,0.059,Negative
310,Buy while it’s low here we go baby hold brothers and sisters. To the moon 🌚🚀🚀🚀💎💎,1619442239.0,2021-04-26 13:03:59,-0.2732,0.08,0.92,0.0,Negative
311,Next sell off will probably be at .40 for the weak minded chicken $hit$ that bought in high.,1619442591.0,2021-04-26 13:09:51,-0.4404,0.146,0.854,0.0,Negative
312,Yeah whoever the really wealthy person is that’s drawing the DOGE head for the second time in as many times needs to stop!! Haha,1619442697.0,2021-04-26 13:11:37,0.7489,0.071,0.65,0.279,Positive
313, [Dogecoin Price Prediction: DOGE primed to retest all-time highs (fxstreet.com)](https://www.fxstreet.com/cryptocurrencies/news/dogecoin-price-prediction-doge-primed-to-retest-all-time-highs-202104260756),1619442802.0,2021-04-26 13:13:22,0.0,0.0,1.0,0.0,Neutral
314,Where you at North Africa? Shout out to you Sheebs!,1619442896.0,2021-04-26 13:14:56,0.0,0.0,1.0,0.0,Neutral
315,Is it all these energy drinks that are giving me heart palpitations or do I sense we are about to take off?,1619443195.0,2021-04-26 13:19:55,0.8271,0.0,0.686,0.314,Positive
316,"Cramer needs to stop bad mouthing Doge with false info on CNBC. There are already sports teams accepting it, do your research and stop shilling ETH.",1619443386.0,2021-04-26 13:23:06,-0.6486,0.243,0.677,0.08,Negative
317,Did you notice ... 1.6 Shiba's here ( was 1.5 ),1619443776.0,2021-04-26 13:29:36,0.0,0.0,1.0,0.0,Neutral
318,Still holding at .3602. Love it that Cuban took it as payment for tickets to a game. 0l.,1619444217.0,2021-04-26 13:36:57,0.6369,0.0,0.802,0.198,Positive
319,I keep buying the dip and I've averaged up to .19  the dips are getting a little more risky for me. we gotta push this above .30.,1619444375.0,2021-04-26 13:39:35,-0.2058,0.065,0.935,0.0,Negative
320,Doge,1619445003.0,2021-04-26 13:50:03,0.0,0.0,1.0,0.0,Neutral
321,Just transferred half of my DOGE to the Ledger Nano S. Feels good to have those DOGEs securely stored.,1619445318.0,2021-04-26 13:55:18,0.6486,0.0,0.762,0.238,Positive
322,BUY THE DIP WHAT ARE YALL WAITING FOR WE ABOUT TO ROCKET THIS IS JUST JET LAG!!!,1619446159.0,2021-04-26 14:09:19,-0.5067,0.17,0.83,0.0,Negative
323,"Quick question, is robinhood ok to use or would it be worth selling to break even then buying using a different app?",1619446321.0,2021-04-26 14:12:01,0.4767,0.0,0.83,0.17,Positive
324,"People holding,  the shuttle to the moon will leave soon . The people selling look what happened when it was chilling at 5 cents for a while. THE ENGINES ARE JUST WARMING UP RN",1619447297.0,2021-04-26 14:28:17,0.2577,0.065,0.87,0.065,Positive
325,Whats the best site for stock and crypto news?,1619447456.0,2021-04-26 14:30:56,0.6369,0.0,0.656,0.344,Positive
326,The whales will attack us. Stand your ground. Once they are no longer a player we go to the moon.,1619448578.0,2021-04-26 14:49:38,-0.6486,0.227,0.773,0.0,Negative
327,Why ppl selling at 27 lately like is everything ok at home? Lets live a little more,1619449560.0,2021-04-26 15:06:00,0.5719,0.0,0.761,0.239,Positive
328,I like the coin 🐶🐶🐶🌝🌝🌝🚀🚀🚀,1619450664.0,2021-04-26 15:24:24,0.3612,0.0,0.894,0.106,Positive
329,HODL for the bayybee,1619451959.0,2021-04-26 15:45:59,0.0,0.0,1.0,0.0,Neutral
330,"Yap!

[https://www.wsj.com/articles/dogecoin-is-a-joke-but-its-no-laughing-matter-11619092837](https://www.wsj.com/articles/dogecoin-is-a-joke-but-its-no-laughing-matter-11619092837)",1619452530.0,2021-04-26 15:55:30,0.0,0.0,1.0,0.0,Neutral
331,"**WILL DOGECOIN REACH 1 DOLLAR IN 2021?**

**FINAL ANSWER: ""PROBABLY, YES"" as per the below article.**

[https://www.inverse.com/innovation/will-dogecoin-reach-1-dollar-in-2021](https://www.inverse.com/innovation/will-dogecoin-reach-1-dollar-in-2021)",1619453780.0,2021-04-26 16:16:20,0.6447,0.0,0.74,0.26,Positive
332,My cautiously optimistic hope is that either Coinbase or Robinhood is the whale that is transferring between wallets in preparation for big announcements from their platforms.,1619453971.0,2021-04-26 16:19:31,0.6369,0.0,0.822,0.178,Positive
333,Is this thing gonna dip to .16 again today,1619454645.0,2021-04-26 16:30:45,0.0,0.0,1.0,0.0,Neutral
334,What do you all exactly think the moon is when you say “to the moon?”,1619456318.0,2021-04-26 16:58:38,0.0,0.0,1.0,0.0,Neutral
335,If doge levels off for a while in .25 range that’s good for the coin. People will be more inclined to invest if it’s stable.,1619457156.0,2021-04-26 17:12:36,0.6249,0.0,0.819,0.181,Positive
336, https://twitter.com/AmazonHelp    Everyone ask them if they accept Doge,1619457486.0,2021-04-26 17:18:06,0.3818,0.0,0.729,0.271,Positive
337,Ransacking my wifes purse so I can buy another 50 Doge!!!!,1619458587.0,2021-04-26 17:36:27,0.0,0.0,1.0,0.0,Neutral
338,added another 1k doge 🐕🐕🐕,1619458706.0,2021-04-26 17:38:26,0.0,0.0,1.0,0.0,Neutral
339,HODL,1619462152.0,2021-04-26 18:35:52,0.0,0.0,1.0,0.0,Neutral
340,19K dogecoins and would add more but a poor boy rn 🐶🐶🌝🌝🌝🚀🚀🚀🤑🤑🤑,1619462662.0,2021-04-26 18:44:22,-0.6752,0.124,0.876,0.0,Negative
341,Most whale wallets and them dam day traders are selling at 0.26/0.27 they don’t want use to pass so buy more & hodl we will get to Mars 🚀,1619463053.0,2021-04-26 18:50:53,0.0772,0.0,0.956,0.044,Positive
342,Stuck at .266,1619463069.0,2021-04-26 18:51:09,-0.25,0.5,0.5,0.0,Negative
343,So what’s suppose to happen today after market close?   You think doge is going to pump some real numbers?,1619463348.0,2021-04-26 18:55:48,0.0,0.0,1.0,0.0,Neutral
344,Just thru some sheckles on NFTart and Anubi coin!!!! Holding all over!!! 💎 🙌🏼,1619463526.0,2021-04-26 18:58:46,0.0,0.0,1.0,0.0,Neutral
345,Big wall,1619464974.0,2021-04-26 19:22:54,0.0,0.0,1.0,0.0,Neutral
346,"So who the f is running that 1-2% algo/bot for the last 19 hrs creating the logjam?

Anyone have any clue / insight?

I'm not complaining (longtime hodler) just curious as to opinions.",1619465296.0,2021-04-26 19:28:16,0.6654,0.0,0.823,0.177,Positive
347,It was following the other crypto for a while wonder what happened,1619465440.0,2021-04-26 19:30:40,0.0,0.0,1.0,0.0,Neutral
348,I kinda like the lack of movement after crazy last week. Maybe it’s a good sign but I don’t really know anything :),1619465758.0,2021-04-26 19:35:58,0.6938,0.11,0.617,0.273,Positive
349,"I noticed as soon as it goes in an upward trend of around 3-4 spikes, it goes back down by almost +0.06$+

Are whales still dumping everytime it goes up ? Will they always do that ?",1619466823.0,2021-04-26 19:53:43,-0.3939,0.069,0.931,0.0,Negative
350,"Hi, I think I might just have been scammed. Sent my crypto to a fraudulent account. Transaction is completed. Anybody knows how I can get it back? 😩",1619467468.0,2021-04-26 20:04:28,-0.6486,0.164,0.836,0.0,Negative
351,Congratulations my dear friends,1619467726.0,2021-04-26 20:08:46,0.8625,0.0,0.094,0.906,Positive
352,🚀🚀🚀,1619467757.0,2021-04-26 20:09:17,0.0,0.0,1.0,0.0,Neutral
353,Hey doge lovers! I love u,1619468113.0,2021-04-26 20:15:13,0.8356,0.0,0.336,0.664,Positive
354,Paw Bamp! 🐕 ~~0.27~~ 0.26 is the new floor! 🚀,1619468219.0,2021-04-26 20:16:59,0.0,0.0,1.0,0.0,Neutral
355,.27 and they sell....,1619468463.0,2021-04-26 20:21:03,0.0,0.0,1.0,0.0,Neutral
356,"Nice little taste of .27, you slobbering doges",1619468612.0,2021-04-26 20:23:32,0.4215,0.0,0.714,0.286,Positive
357,"Just bought another 185 doge, almost up to 1k",1619470724.0,2021-04-26 20:58:44,0.0,0.0,1.0,0.0,Neutral
358,Every Doge has its day,1619471389.0,2021-04-26 21:09:49,0.0,0.0,1.0,0.0,Neutral
359,HODL!,1619471544.0,2021-04-26 21:12:24,0.0,0.0,1.0,0.0,Neutral
360,"Idk why $1 is the ultimate goal, seems like we can go so much higher, etheruem used to be less than a dollar and got all the way up to 2.5k",1619471762.0,2021-04-26 21:16:02,0.2732,0.043,0.881,0.076,Positive
361,HODL,1619472232.0,2021-04-26 21:23:52,0.0,0.0,1.0,0.0,Neutral
362,"It’s ok. Bitcoin, ethereum doge are all dipping... don’t worry",1619472235.0,2021-04-26 21:23:55,-0.4404,0.244,0.756,0.0,Negative
363,Anyone know a way to buy doge if you live in new york? I can't get binance to work even with a vpn...,1619472484.0,2021-04-26 21:28:04,0.0,0.0,1.0,0.0,Neutral
364,"No, the inflation is minimal on the much larger scale of things.",1619472523.0,2021-04-26 21:28:43,0.0,0.0,1.0,0.0,Neutral
365,"Bought back in, picked up like 40 odd doggies with me. Now I'm at 2830 doges",1619472557.0,2021-04-26 21:29:17,0.0516,0.122,0.745,0.133,Positive
366,Where does bellybutton lint come from?,1619473768.0,2021-04-26 21:49:28,0.0,0.0,1.0,0.0,Neutral
367,I’m bored so I bought more Doge! 555 coins to be exact. Since I’m on Robin Hood am I affecting the price in any way?,1619476493.0,2021-04-26 22:34:53,-0.3382,0.091,0.909,0.0,Negative
368,"We are running right in line with the averages. Smack dab on. No one should be selling.....not a single person. 

It's going to be boring throughout the evening. So like I said this this morning......and I'll say it again, go do something. Check back every so often. Just nothing happening and nothing worth noting.",1619476733.0,2021-04-26 22:38:53,-0.2322,0.104,0.842,0.055,Negative
369,"Just 750 more making my total 8,800, I know its not much, but I wanna do as much as I can to break down this .27 wall.",1619476785.0,2021-04-26 22:39:45,0.0,0.0,1.0,0.0,Neutral
370,Push it .... push it real good,1619477424.0,2021-04-26 22:50:24,0.4404,0.0,0.674,0.326,Positive
371,Such stable,1619478093.0,2021-04-26 23:01:33,0.296,0.0,0.312,0.688,Positive
372,"“Does press increase volume”

Yes it does. Marketing and reaching as large an audience as possible is the key to any type of growth",1619478544.0,2021-04-26 23:09:04,0.8126,0.0,0.68,0.32,Positive
