,comment,unix_timestamp,created_utc,polarity score,negative score,neutral score,positive score,Comment Score
0,"I’m thinking about coding a live Dogecoin chart and comment log. No accounts, free for any Doger to use. Anyone interested in using something like this? 🤔",1619430165.0,2021-04-26 09:42:45,0.0767,0.144,0.704,0.152,Positive
1,"**Just in - Mark Cuban tweets.**

**Just talked to my friends at BitPay, they do the Mavs Doge sales.** 

**Not only do the Mavs sales continue to grow, but Bitpay says they are on track to do 6k Doge transactions in April !  Rocket Rocket Rocket.**

[https://twitter.com/mcuban/status/1386766964614328321](https://twitter.com/mcuban/status/1386766964614328321)",1619467893.0,2021-04-26 20:11:33,0.3274,0.0,0.952,0.048,Positive
2,"I will repeat this one more time. We were praying to reach 09/010 cents just oner a week ago. And the coin is stabilising around .26 and people are complaining, are you kidding me. BTC went all the way to over 64000$ and its having s hard time to keep  it at 52/53000$ for a while now while Doge was moving . If you are not patient just go pick another habit  and leave crypto alone.",1619468108.0,2021-04-26 20:15:08,-0.1027,0.08,0.858,0.062,Negative
3,"Wtf.... doge has been between .26 and .27 all day and people are freaking out. It’s DIPPING....ITS MOONING....ITS DIPPING! 

No people....It’s been stable all effing day. Smoke a fatty. Hit up some Tito’s and cran. Do a shot. Go beat off or something  but please....pretty please with sugar on top.....chill out! 

I’m very happy to see doge chill in the mid twenties for a while before it hits the next run. 

Don’t we remember when doge stabilized at .07 for a few weeks before it took off?

All is good in the doge hood.",1619471951.0,2021-04-26 21:19:11,0.8903,0.055,0.81,0.135,Positive
4,I just want to say thank you all for actually holding and taking this serious. It might take min but patience is key!,1619484914.0,2021-04-27 00:55:14,0.2511,0.049,0.82,0.131,Positive
5,[CUBAN: Because Doge is the one coin that people actually use for transactions.  We take many others via @BitPay . But people spend their Doge and that means more businesses will start taking it. The greatest inhibitor to it's growth is that you can't spend the Doge you buy on Robinhood](https://twitter.com/mcuban/status/1386775439763337216?s=21),1619469088.0,2021-04-26 20:31:28,0.8674,0.025,0.818,0.157,Positive
6,I finally did it 1000 dogecoin!!!,1619477011.0,2021-04-26 22:43:31,0.0,0.0,1.0,0.0,Neutral
7,"We are too many to have to worry about anything getting in the way!

There are too many of us to let them win, there are enough of us, we can call ourselves an Army. We don't need to be afraid of Golden Sacks, Bitcoin Billionaires, or the rest of Crypto World haters because although they have more money then everyone combined, they make up only 1% of the global population, but we are part of the 99% of the rest of the population.

“Unions are about the collective leverage, the power of numbers versus the power of capital.” --Kevin O'Leary

So, what can over a million and a half people do, pooling together their resources and intelligence.
They may have millions of dollars but we have millions of people and the value is exponentially greater. We don't have to let them win. I am willing to sacrifice whatever I can, if anyone else is in it with me. There is a reason greater than ourselves or our material wealth but we have to do it together. ALL of Us!",1619469288.0,2021-04-26 20:34:48,0.9712,0.02,0.855,0.124,Positive
8,"If ain’t much, but I purchased my first 749 dogges.",1619485947.0,2021-04-27 01:12:27,0.0,0.0,1.0,0.0,Neutral
9,"MARK CUBAN IS OUR DADDY NOW

https://twitter.com/mcuban/status/1386766964614328321?s=21",1619466121.0,2021-04-26 19:42:01,0.0,0.0,1.0,0.0,Neutral
10,"So much positive news today, Okcoin listed Doge, Mark Cuban tweeting about nearing 6k doge transactions for the Mavs merch sales, some small businesses starting to accept Doge as payment. I'm pretty excited for what's more to come.",1619467575.0,2021-04-26 20:06:15,0.9017,0.0,0.738,0.262,Positive
11,"I'll be the first to say it: Today is the best thing that could have happened to Doge. I know we are all hoping for the coin to go up, but we've been so consistent being above .26 the whole day, this is an absolute win. It may be ugly, and its not going to be fun to see that we only went up to probably .27/.28 by the end of the day, but after the fall-out of Doge Day, this isn't necessarily a bad thing.",1619470076.0,2021-04-26 20:47:56,0.9257,0.043,0.781,0.175,Positive
12,"Big NEWS! Mark Cuban just tweeted:

""Tomorrow I'm on [@TheEllenShow](https://twitter.com/TheEllenShow), talking about ....you guessed it [\#dogecoin](https://twitter.com/hashtag/dogecoin?src=hashtag_click) !""

Expect some pump",1619478869.0,2021-04-26 23:14:29,0.0,0.0,1.0,0.0,Neutral
13,Elon believes in Doge for a reason guys. Hodl,1619462973.0,2021-04-26 18:49:33,0.0,0.0,1.0,0.0,Neutral
14,Dam this is stable af. So stable it’s boring lol,1619470478.0,2021-04-26 20:54:38,0.6032,0.16,0.374,0.467,Positive
15,"Who else got into other cryptos because of doge? I was always too scared to put money in since I didn’t know enough about it, but doge finally got me into it.",1619477067.0,2021-04-26 22:44:27,-0.2382,0.059,0.941,0.0,Negative
16,I really wish everybody would chill out. I literally stared at .05-.06 for what felt like a year. This is nothing! Everybody wooooosssaaaahhhhhh,1619479709.0,2021-04-26 23:28:29,0.6989,0.0,0.784,0.216,Positive
17,Please take s moment of silence to send thoughts and prayers to the family of one of the core developers of DOGE who passed away on Saturday  after loosing her fight to cancer. She will be missed and remembered in this wonderful community .,1619451066.0,2021-04-26 15:31:06,-0.3664,0.168,0.711,0.122,Negative
18,[https://twitter.com/OKCoin/status/1386734173935874053](https://twitter.com/OKCoin/status/1386734173935874053) \- Doge now on Okcoin,1619463197.0,2021-04-26 18:53:17,0.0,0.0,1.0,0.0,Neutral
19,I am currently drinking some bourbon listening to Frank Sinatra’s “Fly me to the Moon” 🚀🌙,1619482710.0,2021-04-27 00:18:30,0.0,0.0,1.0,0.0,Neutral
20,mark cuban is on ellen tomorrow to talk about dogecoin. will dogecoin hit off?,1619482888.0,2021-04-27 00:21:28,0.0,0.0,1.0,0.0,Neutral
21,I hope everybody who have invested in Doge get rich!,1619483044.0,2021-04-27 00:24:04,0.7777,0.0,0.541,0.459,Positive
22,"So this sub is now off of the top growing subs, we've established a good floor around .26, and I haven't seen anywhere near as much talk about doge as the last 2 weeks. I bet we run sideways for 2-3 months until the next leg up. Time to relax and hold.",1619464493.0,2021-04-26 19:14:53,0.8074,0.0,0.838,0.162,Positive
23,funny seeing ppl selling after such positive info about doge from bitpay (thru mark cuban) 🤷🤷🐕💎🙌🚀,1619468669.0,2021-04-26 20:24:29,0.7579,0.0,0.78,0.22,Positive
24,I put 20k in Doge 20 minutes ago. Let’s go.HODL,1619470273.0,2021-04-26 20:51:13,0.0,0.0,1.0,0.0,Neutral
25,"Robinhood wallets incoming...
Coinbase listing inevitable...
Tesla acceptance likely...
Mark Cuban support unwavering...
SpaceX taking a literal Doge to the literal moon...
🚀 🚀 🚀 🚀  🚀",1619477815.0,2021-04-26 22:56:55,0.6908,0.0,0.814,0.186,Positive
26,"People who are mad at DOGE for taking attention away from ""other more important crypto projects"" gotta realize just like anything else in the world, DOGE is branded better, and easier to understand for most people, so it's popularity isn't going anywhere.

It's like the arguments against Marvel movies. ""ItS nOt ReAl CinEma"". Well sometimes people would rather pay to see a dude in tights explode some stuff than watch Oscar films.  Same way sometimes people wanna invest in an idiot-proof cute puppy coin. It is what it is.",1619462382.0,2021-04-26 18:39:42,0.9162,0.084,0.712,0.203,Positive
27,Ladies and gentlemen. Just dropped another $5k into doge. 39k held.,1619463812.0,2021-04-26 19:03:32,0.0,0.0,1.0,0.0,Neutral
28,doge 👏 doge 👏 doge 👏 doge 👏,1619467534.0,2021-04-26 20:05:34,0.0,0.0,1.0,0.0,Neutral
29,At least it's been stable for a few days now...,1619467949.0,2021-04-26 20:12:29,0.296,0.0,0.804,0.196,Positive
30,I like doge,1619474038.0,2021-04-26 21:53:58,0.3612,0.0,0.444,0.556,Positive
31,"**HODL TO THE LEFT**

**HODL TO THE RIGHT** 

**HODL IN A CIRCLE**

**HODL REAL TIGHT**",1619477971.0,2021-04-26 22:59:31,0.0,0.0,1.0,0.0,Neutral
32,Mark cuban’s going on ellen to talk about dogecoin! Brace yourselves dogestranauts,1619478918.0,2021-04-26 23:15:18,0.0,0.0,1.0,0.0,Neutral
33,https://twitter.com/mcuban/status/1386817829438038024,1619479373.0,2021-04-26 23:22:53,0.0,0.0,1.0,0.0,Neutral
34,Can we make the new floor 35c? I’m tired of looking at this red licorice pointing down.,1619483228.0,2021-04-27 00:27:08,-0.4404,0.153,0.847,0.0,Negative
35,"just remember we are consolidating. this is a breakout signal. the next bull run isn't long from now, no doubt about that.",1619483246.0,2021-04-27 00:27:26,0.2755,0.0,0.909,0.091,Positive
36,Really hope we hit .50 this week coming up idk I have feeling,1619483379.0,2021-04-27 00:29:39,0.5095,0.087,0.621,0.292,Positive
37,Mark Cuban is pretty smart. Gonna have all of us watching the stupid Ellen show tomorrow,1619487408.0,2021-04-27 01:36:48,0.3612,0.152,0.583,0.265,Positive
38,Good morning who is still holding with me?!,1619458742.0,2021-04-26 17:39:02,0.4926,0.0,0.687,0.313,Positive
39,"Does anybody else come to check these discussions a few times a day? Lmao 😂 Doge is the first thing I've ever invested in, and I'll admit it's kind of scary watching your money go up and down and up and down. I'm not expecting to become filthy rich, but I sure hope one day I'll be able to put something nice back into my savings. Hodl 🤌",1619462645.0,2021-04-26 18:44:05,0.9194,0.044,0.746,0.21,Positive
40,"I see a lot of people commenting on posts complaining that there’s no future in doge because coins are added every day. It’s true that every day more coins are added, however every doge is bought and accounted for. If you all would just hold, supply and demand would drive the price up. Those of you that are here to make a quick buck are missing out on the potential we could achieve. If a whale starts selling, buy the dip and he can’t get back in. The rocket can’t take off if people keep stealing the fuel",1619462726.0,2021-04-26 18:45:26,-0.765,0.107,0.866,0.026,Negative
41,Bought .0056 have not sold a single one.,1619465280.0,2021-04-26 19:28:00,0.0,0.0,1.0,0.0,Neutral
42,"It's stable, 

Too stable",1619465306.0,2021-04-26 19:28:26,0.5267,0.0,0.312,0.688,Positive
43,Mark Cuban tweet just now pumping Doge! [Mavs sales on track for 6k DOGE transactions in April!](https://twitter.com/mcuban/status/1386766964614328321?s=21),1619466288.0,2021-04-26 19:44:48,0.0,0.0,1.0,0.0,Neutral
44,Anyone else listen to click bait youtube videos on dogecoin for encouragement to hodl? Final Stand is most exciting for me.,1619467345.0,2021-04-26 20:02:25,0.7425,0.0,0.751,0.249,Positive
45,Very good news from Cuban. It seems like Doge is going to surpass Ethereum on BitPay.,1619468086.0,2021-04-26 20:14:46,0.6901,0.0,0.711,0.289,Positive
46,15k in coins at .29USD let’s goooo boys,1619471759.0,2021-04-26 21:15:59,0.0,0.0,1.0,0.0,Neutral
47,A lot of website now accept doge !!! Can we create a post where we list all the sites that accept doge for payment ? Like this https://www.businesswire.com/news/home/20210419005997/en/Newegg-Shoppers-Can-Now-Pay-with-Dogecoin,1619472752.0,2021-04-26 21:32:32,0.865,0.0,0.692,0.308,Positive
48,"Such stability

Much wow",1619472756.0,2021-04-26 21:32:36,0.5859,0.0,0.441,0.559,Positive
49,"Hi, my name is deez_treez and I like to buy dogecoin. Thank you giving me the space to get this off my chest.",1619475547.0,2021-04-26 22:19:07,0.7506,0.0,0.73,0.27,Positive
50,Mark Cuban said he will be on the Ellen show talking about doge coin. Let’s see what happens. The current dip is a steal because imo this will make it shoot up. Tooo the moooooon!!! 🚀🚀🚀,1619478208.0,2021-04-26 23:03:28,-0.7562,0.152,0.848,0.0,Negative
51,"BUYYY

&#x200B;

[https://twitter.com/mcuban/status/1386817829438038024](https://twitter.com/mcuban/status/1386817829438038024)",1619478245.0,2021-04-26 23:04:05,0.0,0.0,1.0,0.0,Neutral
52,I just found out my younger sister bought 3200 dogecoins at .02 (even before I did) and HELD. So proud 🥲,1619478359.0,2021-04-26 23:05:59,0.6113,0.0,0.834,0.166,Positive
53,It’s like mark and Elon just want to make peoples lives a little easier 🥺😊,1619479179.0,2021-04-26 23:19:39,0.8836,0.0,0.565,0.435,Positive
54,Doge will be the new bit coin ! More and more retail markets are picking the coin up ! We need Robinhood now to create a wallet for doge then boom ! This stock is here for the long haul ! It’s just the beginning hold for future,1619479957.0,2021-04-26 23:32:37,0.5053,0.0,0.935,0.065,Positive
55,"Dogecoin investors when they see the price slightly break through a ceiling: YESSSSSSSSSSSSSSSSSSSSSIRRRRRRRRRRRR GRAB THE ROCKET

It's me I'm doge investors <3",1619480926.0,2021-04-26 23:48:46,0.4404,0.0,0.879,0.121,Positive
56,"If I’ve learned anything as a holder of coins at .00254, it’s holdddd",1619482310.0,2021-04-27 00:11:50,0.0,0.0,1.0,0.0,Neutral
57,Gonna tell my kids about the **Battle of .27**,1619487478.0,2021-04-27 01:37:58,-0.3818,0.245,0.755,0.0,Negative
58,So why all coins are going up and doge is still around 0.27?,1619438073.0,2021-04-26 11:54:33,0.0,0.0,1.0,0.0,Neutral
59,Hello Shibes let's get this thing moving today. Only positive energy. DOGE TO A STEADY .45 WOULD BE AWESOME. THEN NEXT TOO THE MOON!!!,1619438982.0,2021-04-26 12:09:42,0.9083,0.0,0.648,0.352,Positive
60,🎶I believe in a thing called doge!!!🎶,1619444958.0,2021-04-26 13:49:18,0.0,0.0,1.0,0.0,Neutral
61,Bowwowwow yippee yo yippee yay bowwow yippee yo yippee  ysy,1619445179.0,2021-04-26 13:52:59,0.5267,0.0,0.726,0.274,Positive
62,It's about to launch up guys get ready !!!,1619453999.0,2021-04-26 16:19:59,0.5229,0.0,0.703,0.297,Positive
63,"I am going to forecast the future...  I use a magic 8 ball and dead reckoning, which is how I forecast financials at work...    Doge is going to bounce around mostly between 25 and 27 cents with some short trips beyond that range until sometime in June where it will rocket up to as much as 60 cents then settle back down to hover around 45 cents for another 2 months....  You heard it here folks...Your welcome....",1619454459.0,2021-04-26 16:27:39,-0.3182,0.052,0.911,0.036,Negative
64,my goal if this moons is to open an animal rescue and save as many doges as possible 🐕✅. DO ONLY GOOD EVERYDAY. this is my promise,1619456451.0,2021-04-26 17:00:51,0.9087,0.0,0.685,0.315,Positive
65,"Doge is fighting to stay about .27 I'll buy another 100 coins as soon as I can, LETS START OFF MAY IN THE .3s!!!!",1619457846.0,2021-04-26 17:24:06,-0.5673,0.138,0.862,0.0,Negative
66,"Patience is going to be the key to winning at this, my fellow hodlers.",1619462739.0,2021-04-26 18:45:39,0.5267,0.0,0.793,0.207,Positive
67,One doesn’t simply see green until he’s survived in the red,1619463016.0,2021-04-26 18:50:16,0.5106,0.0,0.752,0.248,Positive
68,Great Hodl'ing today. Proud of every single one of ya.,1619463681.0,2021-04-26 19:01:21,0.802,0.0,0.526,0.474,Positive
69,slow and steady wins the race,1619465114.0,2021-04-26 19:25:14,0.5719,0.0,0.575,0.425,Positive
70,what a support on 0.265,1619465417.0,2021-04-26 19:30:17,0.4019,0.0,0.597,0.403,Positive
71,"Article after article, every crypto manager or bitcoin bull continues to trash on Doge. They call it a gamble and bubble that will crash. Amazing how bitcoiners turned into the people they hated once before.",1619466359.0,2021-04-26 19:45:59,-0.4767,0.162,0.749,0.089,Negative
72,.2716 and Europe is half asleep. Will reach .28 easy later tonight,1619468400.0,2021-04-26 20:20:00,0.4588,0.0,0.714,0.286,Positive
73,I spent a good 2 hours today learning to read candle sticks and depth charts. It was very helpful. Simple Google search will pull up lots of good info. Check it out shibes if you haven't already!,1619475718.0,2021-04-26 22:21:58,0.8475,0.0,0.787,0.213,Positive
74,kinda amazing that we've consistently held it at .26 for the past couple of days. Great work shibes,1619477702.0,2021-04-26 22:55:02,0.8228,0.0,0.678,0.322,Positive
75,who's a good boy? who likes 27? YOU DO! YOU DOOOOOOOOOO!,1619478592.0,2021-04-26 23:09:52,0.768,0.0,0.575,0.425,Positive
76,"If Robinhood puts in a wallet, that's a game changer. We'll be able to spend our crypto the way God wants us to. Spend Doge, Save BTC, Change World",1619478819.0,2021-04-26 23:13:39,0.6486,0.0,0.836,0.164,Positive
77,We should all go buy some maverick merchandise tonight to show Marc the power of the Doge army.,1619481474.0,2021-04-26 23:57:54,0.0,0.0,1.0,0.0,Neutral
78,Mark Cuban talking about Dogecoin on Ellen,1619481729.0,2021-04-27 00:02:09,0.0,0.0,1.0,0.0,Neutral
79,"Fresh out of fresh. Mark is bull on Dogecoin.

[https://publish.twitter.com/?query=https%3A%2F%2Ftwitter.com%2Fmcuban%2Fstatus%2F1386817829438038024&widget=Tweet](https://publish.twitter.com/?query=https%3A%2F%2Ftwitter.com%2Fmcuban%2Fstatus%2F1386817829438038024&widget=Tweet)",1619481839.0,2021-04-27 00:03:59,0.6072,0.0,0.617,0.383,Positive
80,[https://twitter.com/mcuban/status/1386817829438038024](https://twitter.com/mcuban/status/1386817829438038024),1619483038.0,2021-04-27 00:23:58,0.0,0.0,1.0,0.0,Neutral
81,You guys see the NBA team rockets now accepting doge?! Huge,1619486137.0,2021-04-27 01:15:37,0.636,0.0,0.634,0.366,Positive
82,robinhood needs a wallet so we can use our #DOGECOIN,1619486209.0,2021-04-27 01:16:49,0.0,0.0,1.0,0.0,Neutral
83,"Doge going to get exposure to a whole new audience tomorrow.  That can’t hurt. 

To the moon!",1619486470.0,2021-04-27 01:21:10,-0.5707,0.187,0.813,0.0,Negative
84,The greatest trick dogecoin ever pulled was convincing the world it was just a meme coin.,1619438312.0,2021-04-26 11:58:32,0.7717,0.057,0.616,0.327,Positive
85,"My niece wanted a barbie house for her 6th birthday..

I gave her 500 of my doges instead

She hates me now

She will thx me later",1619484714.0,2021-04-27 00:51:54,-0.1027,0.095,0.822,0.082,Negative
86,"I f\*\*\*ing love this community, but jesus...the frequent garbage that pops up here now that the Doge is famous...guys and gals, please at least do a litte research urself before use of/investment in any cryptocurrency...or any investment in general!",1619430473.0,2021-04-26 09:47:53,0.7043,0.0,0.864,0.136,Positive
87,Thousands of opinions on this sub and everybody is a crypto expert but $DOGE took 3 days to become almost 9-10 times its value this month. This has phenomenally shaken up the crypto world and has brought a ton of new people in as well. One week later do you guys really think $DOGE is dead? Lol. It's only higher and upwards from here.,1619436802.0,2021-04-26 11:33:22,0.2617,0.098,0.778,0.125,Positive
88,"Nice, broke 1.6M members on the page today. Way to go everyone. Best place on Earth",1619465497.0,2021-04-26 19:31:37,0.6369,0.123,0.57,0.307,Positive
89,"Waiting in the line for covid 19 test, have dogecoin in my mind",1619433071.0,2021-04-26 10:31:11,0.0,0.0,1.0,0.0,Neutral
90,I love you all ❤️🚀🌕 I’m finishing up a siding job today and getting more doge😎 hope y’all make a wonderful day for yourself!,1619440407.0,2021-04-26 12:33:27,0.9368,0.0,0.661,0.339,Positive
91,lets break .28 wall,1619441922.0,2021-04-26 12:58:42,0.0,0.0,1.0,0.0,Neutral
92,Our community is growing at the pace that other coins can only dream of 👀,1619441972.0,2021-04-26 12:59:32,0.4019,0.0,0.778,0.222,Positive
93,Lolol we here staring at fractions of pennies.,1619442874.0,2021-04-26 13:14:34,0.0,0.0,1.0,0.0,Neutral
94,RIP SPORKLIN,1619446564.0,2021-04-26 14:16:04,0.0,0.0,1.0,0.0,Neutral
95,"This has been the trend before every large doge run. The price fluctuates along a steady plane for a period of time and investors lose their minds on all the little ups and downs. Then, BOOM, we’re up 3000%. If you’re holding out for the $1+ mark you don’t need to be checking your status daily, or weekly for that matter. This is true even if you’re trying to average down or increase your stake. Set limit buys at the price point you want and walk away. You’ll get an email notification when your order executes. 

Lesson: if you find yourself stressing over the daily tic, either set it and forget it, or liquidate your investment and find somewhere safer to put your money.",1619447475.0,2021-04-26 14:31:15,0.296,0.053,0.87,0.077,Positive
96,Just got to 1k doge!! 🐕🐕,1619450585.0,2021-04-26 15:23:05,0.0,0.0,1.0,0.0,Neutral
97,Was buying doge at 0.35 worth it,1619450863.0,2021-04-26 15:27:43,0.2263,0.0,0.759,0.241,Positive
98,Ebay petition to accept Dogecoin [http://chng.it/NNnrdYrBT4](http://chng.it/NNnrdYrBT4)  Don't have to donate.,1619450873.0,2021-04-26 15:27:53,0.3818,0.0,0.776,0.224,Positive
99,Just bought my first stack of dogecoin - HODL!,1619451298.0,2021-04-26 15:34:58,0.0,0.0,1.0,0.0,Neutral
100,I had a dream that Dogecoin hit $7 last night,1619452454.0,2021-04-26 15:54:14,0.25,0.0,0.818,0.182,Positive
101,"Drill baby drill, missed the rocket up but I can get in for the next one",1619454863.0,2021-04-26 16:34:23,-0.1531,0.096,0.904,0.0,Negative
102,2 weeks ago doge was .05 cents. Now we are steady between .25 and .30. Keep the faith people...,1619455448.0,2021-04-26 16:44:08,0.4215,0.0,0.865,0.135,Positive
103,I hope we reach .28 or .29 STABLE today lol.,1619456093.0,2021-04-26 16:54:53,0.8286,0.0,0.381,0.619,Positive
104,I hate short sellers,1619460089.0,2021-04-26 18:01:29,-0.5719,0.552,0.448,0.0,Negative
105,My preferred pronouns are doj doge and dohj,1619463004.0,2021-04-26 18:50:04,0.0,0.0,1.0,0.0,Neutral
106,"Some days you're on the crazy roller coaster.

Some days you're on the smooth kiddy ride.",1619463591.0,2021-04-26 18:59:51,-0.34,0.138,0.862,0.0,Negative
107,Right on time. Its buy o clock,1619464060.0,2021-04-26 19:07:40,0.0,0.0,1.0,0.0,Neutral
108,Anyone that buy above .4 still holding?,1619464309.0,2021-04-26 19:11:49,0.0,0.0,1.0,0.0,Neutral
109,Calm before the storm. And I mean that in a good way!,1619464703.0,2021-04-26 19:18:23,0.6696,0.0,0.645,0.355,Positive
110,Bought mine at 0.23 and already make $5k 🚀🚀🚀,1619465283.0,2021-04-26 19:28:03,0.0,0.0,1.0,0.0,Neutral
111,Camping World is going to use BitPay to accept crypto.,1619465719.0,2021-04-26 19:35:19,0.3818,0.0,0.776,0.224,Positive
112,Just wanted to say I am loving how kind everyone is being to the newbies - keep that same energy!  We were all newbies at one time!,1619465756.0,2021-04-26 19:35:56,0.8745,0.0,0.706,0.294,Positive
113,My avg is .2699 so these last few days have been real fun.,1619467501.0,2021-04-26 20:05:01,0.5106,0.0,0.784,0.216,Positive
114,[deleted],1619469426.0,2021-04-26 20:37:06,0.0,0.0,1.0,0.0,Neutral
115,if we can hold 26 range during this BTC cliff we will be in great shape!,1619471220.0,2021-04-26 21:07:00,0.6588,0.0,0.774,0.226,Positive
116,"@ all newbs using RH - scheduled crypto maintenance goes down around this time every day, it’s not “down”",1619472714.0,2021-04-26 21:31:54,0.0,0.0,1.0,0.0,Neutral
117,my limit buys didnt hit when it dipped. does that mean everyone is holding and not selling?!!! GREAT JOB PEEPS!,1619473562.0,2021-04-26 21:46:02,-0.7188,0.208,0.792,0.0,Negative
118,"Why resist .27? Resistance is futile! .35, .69, MOON",1619473792.0,2021-04-26 21:49:52,-0.4926,0.285,0.715,0.0,Negative
119,"Kentucky law firm to accept DOGE

https://www.wdrb.com/news/business/louisville-law-firm-is-kentuckys-1st-to-accept-dogecoin-payments/article_81ff5ebc-a2ec-11eb-b8df-cb109588806b.html?fbclid=IwAR0VUXxLLNcxmWxI77ekazSSeHMAnZmwQclLXq0G-1Vv_P6zOVJbkOMBUOE",1619474748.0,2021-04-26 22:05:48,0.3818,0.0,0.698,0.302,Positive
120,"Out of all toxic subreddits, this is my most favorite. It's chill here.",1619478442.0,2021-04-26 23:07:22,0.5095,0.0,0.785,0.215,Positive
121,Moon very soon,1619478899.0,2021-04-26 23:14:59,0.0,0.0,1.0,0.0,Neutral
122,https://houston.innovationmap.com/tilman-fertitta-post-oak-motor-cars-dogecoin-2652632763.html,1619479385.0,2021-04-26 23:23:05,0.0,0.0,1.0,0.0,Neutral
123,Mark’s tweet was all that was needed to break the ice. Big day for us all tomorrow,1619480804.0,2021-04-26 23:46:44,0.0,0.0,1.0,0.0,Neutral
124,"I see most NFT , Safe moon, and all those hyped up coins holders are mad right now it dropped and now they talking bad about our boy doge sayings it’s a joke, and blah blah blah , “why isn’t doge dropping? It’s a joke and it’s trash” who’s laughing now 💎",1619482618.0,2021-04-27 00:16:58,0.2177,0.166,0.67,0.164,Positive
125,Almost mined 1000 Dogecoins! Here’s hoping it’ll cover the electricity bills once we hit $1,1619483497.0,2021-04-27 00:31:37,0.4753,0.0,0.819,0.181,Positive
126,Just placed a limit buy $725 at .25 so just hoping it dips a little tonight so I can get to 10k coins,1619486132.0,2021-04-27 01:15:32,0.4728,0.0,0.877,0.123,Positive
127,I think a rocket is coming. I have no actual proof of this but when the charts get this quiet that’s usually when it happens.,1619486284.0,2021-04-27 01:18:04,-0.1531,0.062,0.938,0.0,Negative
128,"Friendly PSA - you haven’t officially lost any money until you cash out. AKA HODL, HODL, HODL 

and when your faith begins to shake, smack yourself out of it and KEEP HODLING. 

Thanks for coming to my TED talk. 

Bork.",1619461066.0,2021-04-26 18:17:46,0.7096,0.084,0.731,0.186,Positive
129,"Had a dream last night that doge skyrocketed and I turned 5,000 into 781,000.  Pray this dream comes true for everyone:)",1619449514.0,2021-04-26 15:05:14,0.81,0.0,0.645,0.355,Positive
