,comment,unix_timestamp,created_utc,polarity score,negative score,neutral score,positive score,Comment Score
130,"For all the naysayers saying that doge is a bubble and will pop when it hits a dollar, consider this... Every time we hit a milestone (.08, .50) we essentially do have a bubble that grows and pops. But the believers stick around and build from the rubble. In Feb it went from .008 to .08 to .029 in just a few days, but everyone who believed in it stayed around, bought the dip, and created a stable floor. It then drew in new investors and consolidated for what seemed like forever but relatively quickly in comparison to other crytos. Then in april, after a lot of hard work, we got liftoff all the way to .47, the bubble popped to .16, the believers stuck around, and now we're building our floor as we speak. it's getting stronger and stronger, and with a lot of hard work and patience, we'll reach our next milestone. Just remember, the bigger the milestone, the more people will sell out, and more we will have to recover from. But we always recover because of our believers........... snek",1619450534.0,2021-04-26 15:22:14,0.8957,0.029,0.887,0.084,Positive
131,Please stop assigning dates to our success. Did we not learning anything from Doge Day?,1619438466.0,2021-04-26 12:01:06,0.5859,0.109,0.594,0.297,Positive
132,I bought a BMW X6 2 weeks ago with gain from Doge!!!! Love love love the Shiba! 🚀🚀🚀,1619437087.0,2021-04-26 11:38:07,0.9594,0.0,0.482,0.518,Positive
133,"Correct me if I’m wrong but has doge ever moved without Elon prompting it to?

I’m sitting here HODLING 12k Doges and it seems all we do is wait for ELON TO SPEAK 😂😂😂

Ahhh",1619437440.0,2021-04-26 11:44:00,0.8885,0.136,0.63,0.234,Positive
134,Just bought another $925 worth of more doggies,1619439354.0,2021-04-26 12:15:54,0.2263,0.0,0.787,0.213,Positive
135,"PUMP! PUMP! PUMP!  
HODL! HODL! HODL!",1619441660.0,2021-04-26 12:54:20,0.0,0.0,1.0,0.0,Neutral
136,Daily reminder: HODL!,1619441806.0,2021-04-26 12:56:46,0.0,0.0,1.0,0.0,Neutral
137,To the moon 🚀,1619442327.0,2021-04-26 13:05:27,0.0,0.0,1.0,0.0,Neutral
138,it's gonna be nice to be reunited with 30 cents. such a nice fellow,1619442647.0,2021-04-26 13:10:47,0.6808,0.0,0.682,0.318,Positive
139,You’re a jabroni if you sell before 1.0,1619442778.0,2021-04-26 13:12:58,0.0,0.0,1.0,0.0,Neutral
140,"Sad news.

One of the dogecoin core devs, Sporklin, passed away on Saturday  :-(

[https://twitter.com/BillyM2k/status/1386371134640201735](https://twitter.com/BillyM2k/status/1386371134640201735)",1619443874.0,2021-04-26 13:31:14,-0.6808,0.301,0.699,0.0,Negative
141,"I don't understand panic selling. 😕

Especially when doge is destined for the 🌜",1619444788.0,2021-04-26 13:46:28,0.1032,0.11,0.762,0.129,Positive
142,Today is definitely the day we gonna rocket up to new heights brace yourself brothers today we gonna take a good flight 📈📈📈🚀🚀🚀🚀🚀💎🙌🏼🌌🌌🌌,1619445876.0,2021-04-26 14:04:36,0.6808,0.0,0.887,0.113,Positive
143,Feel sorry for the peeps that sold and didn’t buy back in . This is how crypto goes look at the history. .16 to .41 in about a day so on and so forth. Hold hold hold. It isn’t even close to being over yet.,1619446518.0,2021-04-26 14:15:18,-0.0772,0.029,0.971,0.0,Negative
144,BUY THE DIP,1619447309.0,2021-04-26 14:28:29,0.0,0.0,1.0,0.0,Neutral
145,Morning Shibes ☀ Looking fresh! 💐,1619447319.0,2021-04-26 14:28:39,0.3802,0.0,0.659,0.341,Positive
146,"Just checked the order book and someone is trying to buy 1,000,000 dogecoin",1619449597.0,2021-04-26 15:06:37,0.0,0.0,1.0,0.0,Neutral
147,The whales are forming an offensive....Hodl the line!,1619450159.0,2021-04-26 15:15:59,0.0,0.0,1.0,0.0,Neutral
148,I am in still HODLING 4275 Doge! Let's go!,1619453882.0,2021-04-26 16:18:02,0.0,0.0,1.0,0.0,Neutral
149,Hodling 1016 coins. To the moon!!!,1619454053.0,2021-04-26 16:20:53,0.0,0.0,1.0,0.0,Neutral
150,Was buying doge at .4 a good idea,1619455376.0,2021-04-26 16:42:56,0.4404,0.0,0.707,0.293,Positive
151,Looks like we’re stuck at .26 and .27 but who cares! To the moon 🚀,1619455830.0,2021-04-26 16:50:30,0.6749,0.077,0.614,0.309,Positive
152,The Spike is here! The Spike is here!,1619457625.0,2021-04-26 17:20:25,0.0,0.0,1.0,0.0,Neutral
153,The Battle of .27 Cents!,1619457696.0,2021-04-26 17:21:36,-0.4389,0.42,0.58,0.0,Negative
154,We establishing a new floor right now .27,1619458009.0,2021-04-26 17:26:49,0.0,0.0,1.0,0.0,Neutral
155,"It sucks that Bitcoin and Ethereum can continue to climb past their traditional barriers, but we get stuck on .27 every time.  Doge needs to track with those two if we have any chance of eventually breaking out.  But hey, keep selling at .27, glad you are making pennies when you could be making thousands.",1619458090.0,2021-04-26 17:28:10,0.5023,0.069,0.826,0.105,Positive
156,leggo doges 🚀,1619458347.0,2021-04-26 17:32:27,0.0,0.0,1.0,0.0,Neutral
157,.269-.27 seems the stable floor,1619458633.0,2021-04-26 17:37:13,0.296,0.0,0.645,0.355,Positive
158,"When we see green for all crypto, doge will not go to the moon very soon. Doge will only 🚀 suddenly when everyone almost forgets it",1619458866.0,2021-04-26 17:41:06,0.0,0.0,1.0,0.0,Neutral
159,They're giving you every chance to get in or load up more at .27,1619458884.0,2021-04-26 17:41:24,0.5267,0.0,0.732,0.268,Positive
160,Just bought my first 375 shares!,1619461493.0,2021-04-26 18:24:53,0.3595,0.0,0.667,0.333,Positive
161,16k doge and hodl 😤,1619462888.0,2021-04-26 18:48:08,0.0,0.0,1.0,0.0,Neutral
162,At this rate we’ll get to $1 in 10 years,1619463124.0,2021-04-26 18:52:04,0.0,0.0,1.0,0.0,Neutral
163,Liftoff in about 2 months??? Hopefully!😊,1619465252.0,2021-04-26 19:27:32,0.8602,0.0,0.456,0.544,Positive
164,Not about hanging around a certain amount and then selling as soon as it hits the next cent up. Just let it continue to climb and then sell at a dollar or more. The gains will be waaaaay more.,1619468728.0,2021-04-26 20:25:28,0.5829,0.0,0.886,0.114,Positive
165,Doge has really made me stress about my stocks moving just one cent haha 😄,1619469568.0,2021-04-26 20:39:28,0.6637,0.115,0.565,0.32,Positive
166,"Tesla just killed it in their earnings report and Elon LOVES Doge

MOON!",1619469637.0,2021-04-26 20:40:37,-0.0923,0.237,0.544,0.219,Negative
167,"Elon loves doge, Mark Cuban loves doge. They aren’t putting it out there for nothing guys",1619469809.0,2021-04-26 20:43:29,0.8126,0.0,0.654,0.346,Positive
168,Thinking about rolling my Bitcoin in before blastoff. Any advice? Don’t wanna miss out on the moonshot and wish I invested more.,1619470611.0,2021-04-26 20:56:51,0.2732,0.066,0.823,0.111,Positive
169,"7k shares of doge holding since 35 bought more and pulled average down to 31, not sure why people panicking",1619471386.0,2021-04-26 21:09:46,-0.3944,0.202,0.707,0.091,Negative
170,Robinhood giving out 1 mil in crypto as a promotion.  Hopefully this will help get more to buy in and hodllll 🙏🏼,1619471604.0,2021-04-26 21:13:24,0.7783,0.0,0.747,0.253,Positive
171,Doge will be barking at the super pink moon tonight!! Much wowww!!!!!,1619473343.0,2021-04-26 21:42:23,0.7243,0.0,0.685,0.315,Positive
172,Getting a little better at this. Timed that dip perfectly. Another 2K DOGE!,1619474218.0,2021-04-26 21:56:58,0.7963,0.0,0.608,0.392,Positive
173,Just bought another 300. Keep it going,1619477195.0,2021-04-26 22:46:35,0.0,0.0,1.0,0.0,Neutral
174,68k Doge and still holding!,1619477745.0,2021-04-26 22:55:45,0.0,0.0,1.0,0.0,Neutral
175,Come. On.    You. Can. Do. It.,1619478551.0,2021-04-26 23:09:11,0.0,0.0,1.0,0.0,Neutral
176,"Just bought 69$ worth! Last bit of money in my RH Account. Did I see right that Robinhood is creating a wallet? If that's the case, I'm 100% RH.",1619478553.0,2021-04-26 23:09:13,0.5255,0.0,0.86,0.14,Positive
177,The fight for .27 is real don’t let up,1619478578.0,2021-04-26 23:09:38,-0.3818,0.245,0.755,0.0,Negative
178, Rule: Bought and Forgot,1619478914.0,2021-04-26 23:15:14,0.0,0.0,1.0,0.0,Neutral
179,Is Mark Cuban taking over for Elon Musk 🤔,1619479020.0,2021-04-26 23:17:00,0.0,0.0,1.0,0.0,Neutral
180, A dollar soon.,1619479544.0,2021-04-26 23:25:44,0.0,0.0,1.0,0.0,Neutral
181,We’re going to shock the world,1619479892.0,2021-04-26 23:31:32,-0.3818,0.342,0.658,0.0,Negative
182,What if Mark Cuban just bought many coins at .42 and he's sad with us? Much WoW 😹😹🚀🚀🚀,1619480006.0,2021-04-26 23:33:26,0.7579,0.156,0.587,0.257,Positive
183,"So Tesla selling 11% of their Bitcoin holding has made a lot  of people mad at r/cryptocurrency. Here is hoping, they invest that money on Doge tomorrow. lol 😂",1619480339.0,2021-04-26 23:38:59,0.6486,0.12,0.659,0.221,Positive
184,"Smash the ceiling boys, just bought 1.3k more doge, not much but w/e.",1619481019.0,2021-04-26 23:50:19,0.0,0.0,1.0,0.0,Neutral
185,THANK YOU MARK.! To the moon we go! Ellen show tomorrow! Doge🚀🚀🚀🚀🚀🚀🚀🚀😈,1619481301.0,2021-04-26 23:55:01,0.7969,0.0,0.756,0.244,Positive
186,"Volume has dropped extensively to only 4-5 million yet the price has stabilized, leads me to believe we've found our new floor!",1619481574.0,2021-04-26 23:59:34,0.0,0.0,1.0,0.0,Neutral
187,Houston rockets accepting doge!,1619481749.0,2021-04-27 00:02:29,0.4389,0.0,0.509,0.491,Positive
188,"One really thinks Doge being 7th place on crypto world is a joke? 

Better wash your face with sanitizer.

Soon it will be 6th, and then anyone's guess.

Doge is strong, and Doge will change so many lives.

HODL.",1619482156.0,2021-04-27 00:09:16,0.8126,0.0,0.811,0.189,Positive
189,Dat 27cent wall doeeeeeeeee,1619483527.0,2021-04-27 00:32:07,0.0,0.0,1.0,0.0,Neutral
190,We will see you guys in couple of years wish they had bought doge !,1619486174.0,2021-04-27 01:16:14,0.4574,0.0,0.824,0.176,Positive
191,I'm ok with no real movement today. Slow and steady is the way to go.,1619486177.0,2021-04-27 01:16:17,0.0,0.126,0.747,0.126,Neutral
192,Holding all 2021 son.! HODL 🐕 🌙 💰,1619486457.0,2021-04-27 01:20:57,0.0,0.0,1.0,0.0,Neutral
193,"Still holding boys, have not sold one coin🚀🚀🚀🚀",1619486694.0,2021-04-27 01:24:54,0.0,0.0,1.0,0.0,Neutral
194,I just bought my first 650! Wish me luck.,1619428091.0,2021-04-26 09:08:11,0.7177,0.0,0.539,0.461,Positive
195,"Fun fact. If all subscribers of this page buys 83,480 Dogecoins each, all total coins are bought.",1619427108.0,2021-04-26 08:51:48,0.5106,0.0,0.829,0.171,Positive
196,"FUD weirdo: DOGE has no cap so it's doomed

Everybody: So what's the cap on ETHereum?

FUD Weirdo: \*Silence 

&#x200B;

Every time...",1619474264.0,2021-04-26 21:57:44,-0.9512,0.529,0.471,0.0,Negative
197,Remember when Bobby Boucher showed up at halftime and the Muddogs won the Bourbon Bowl!!,1619460321.0,2021-04-26 18:05:21,0.6467,0.0,0.766,0.234,Positive
198,I see DOGE learned STAY now can it learn UP next?,1619462283.0,2021-04-26 18:38:03,0.0,0.0,1.0,0.0,Neutral
199,"Countries like Iran use cryptos do bypass sanctions and do all sorts of other things. Given how insistent Biden administration is to relieve the sanctions, do you guys expect a big crash in the near future?",1619428916.0,2021-04-26 09:21:56,0.3182,0.066,0.811,0.123,Positive
200,This thing has been resting for 3 days almost. A needed time for a bigger jump. C'mon boy.,1619431834.0,2021-04-26 10:10:34,0.0,0.0,1.0,0.0,Neutral
201,"If yalls scared of the whales, then why dont we buy more of the dips, and try to make it a goal to earn more dogecoin.  Them selling to manipulate prices down, remind me of the hedge funds that failed trying to take Gamestop down. Just buy, it will make it harder for the whales to get a hold of more coins",1619432364.0,2021-04-26 10:19:24,-0.7351,0.094,0.906,0.0,Negative
202,"You know, it seems a bit crazy to me that Doge is a $35B machine and yet all it can do right now is spin in place.🤔 I mean, what if it actually started doing stuff, you know acting like a hedge fund, or a Berkshire Hathaway, buying up assets (somehow) and eating up the landscape...I know, I know, crazy talk. But there's real ""money"" in this pool, and a lot of it. I don't see how it can't be a few smart contracts away from being a giant corporation eater. lol Fantasy over. Now just need this doge to get above my average purchase price.",1619433975.0,2021-04-26 10:46:15,0.7876,0.029,0.881,0.089,Positive
203,Had a dream I was up $80k in one day. I think it’s a sign. 🚀,1619434617.0,2021-04-26 10:56:57,0.25,0.0,0.882,0.118,Positive
204,Your daily reminder to HODL Doge!,1619439074.0,2021-04-26 12:11:14,0.0,0.0,1.0,0.0,Neutral
205,"I JUST WENT DIAMOND  HANDS AVATAR FOR DOGE. HODL 
💎cryoto",1619439196.0,2021-04-26 12:13:16,0.4824,0.0,0.761,0.239,Positive
206,"Knowing something is coming and not taking proper measures for it, is the highest degree of stupidity.",1619439255.0,2021-04-26 12:14:15,-0.4404,0.153,0.847,0.0,Negative
207,"For those who purchased somewhere around 1000 coins,

1. First we all really appreciate for your contribution,
2. But, seriously just forget you ever purchased them.
3. Please do not keep looking at price everyday, and throw your emotions on this forum.

Yes you will be rewarded, but if you're seriously hoping your one coin to become $100, $2000 or $10000 each is that may not be an impossible things to happen (imho it's an impossible scenario), but you might pass on your coins to your unborn grand son or grand daughter to see that kind of price per coin.

Just wants to be very transparent with your investment.",1619440117.0,2021-04-26 12:28:37,0.964,0.05,0.762,0.189,Positive
208,Now we broke it 💪,1619442143.0,2021-04-26 13:02:23,-0.4215,0.359,0.641,0.0,Negative
209,I need DOGE to get to $33 per coin to become a millionaire. How about you?,1619442226.0,2021-04-26 13:03:46,0.0,0.0,1.0,0.0,Neutral
210,Hey we hit $0.28! Annnnnd it’s gone...,1619442543.0,2021-04-26 13:09:03,0.0,0.0,1.0,0.0,Neutral
211,Doge has to stop tapping .275 and uppercut that sh#*t,1619442702.0,2021-04-26 13:11:42,-0.296,0.196,0.804,0.0,Negative
212,"Okay Europe, here's your chance to help during a whale battle.",1619442803.0,2021-04-26 13:13:23,0.4588,0.16,0.432,0.407,Positive
213,"0.28 lets not forget the password this time, 3 attempts.....",1619443422.0,2021-04-26 13:23:42,0.1695,0.0,0.844,0.156,Positive
214,The Battle of .28 cents.,1619443506.0,2021-04-26 13:25:06,-0.3818,0.394,0.606,0.0,Negative
215,And all the while.....we do it dogeystyle,1619445074.0,2021-04-26 13:51:14,0.0,0.0,1.0,0.0,Neutral
216,Perfect time to buy the dip :D !!!!,1619446045.0,2021-04-26 14:07:25,0.8721,0.0,0.403,0.597,Positive
217,Today will be a good day for doge!! 🐕,1619446119.0,2021-04-26 14:08:39,0.5399,0.0,0.697,0.303,Positive
218,Very nice to wake up to .27!!! Let's get that up to .3 by the end of the day if we can!!,1619446339.0,2021-04-26 14:12:19,0.6441,0.0,0.831,0.169,Positive
219,I see your limit buy at .269. Your humor is not lost.,1619447098.0,2021-04-26 14:24:58,0.47,0.0,0.711,0.289,Positive
220,Why are we not at 2 million subscribers yet??? Spread the word about the good DOGE!!!,1619449624.0,2021-04-26 15:07:04,0.6504,0.0,0.777,0.223,Positive
221,Another 8000 bought. Hodl bois!,1619450091.0,2021-04-26 15:14:51,0.0,0.0,1.0,0.0,Neutral
222,"Another 6000 coins secured 

next stop: to the moon",1619450261.0,2021-04-26 15:17:41,0.128,0.185,0.588,0.227,Positive
223,Once again it looks like it’s just following the market right now. If it dips today I’m not sweating it. Just gotta ride it out.,1619450404.0,2021-04-26 15:20:04,0.3612,0.0,0.906,0.094,Positive
224,HODL YOUR DOGESSSSS,1619451368.0,2021-04-26 15:36:08,0.0,0.0,1.0,0.0,Neutral
225,Interesting. The Doge and $GME charts are looking similar today.,1619451398.0,2021-04-26 15:36:38,0.4019,0.0,0.769,0.231,Positive
226,"Bought back in at 27 cents. I have 1,000 coins. Is this a reasonable amount?",1619451532.0,2021-04-26 15:38:52,0.0,0.0,1.0,0.0,Neutral
227,Are u ready for this spike ?,1619452900.0,2021-04-26 16:01:40,0.3612,0.0,0.706,0.294,Positive
228,Dogecoin is doing exactly what It did earlier this morning before shooting up follow the daily chart and see for yourself it's almost rocket time,1619453011.0,2021-04-26 16:03:31,0.0,0.0,1.0,0.0,Neutral
229,Hold on to your seats its gonna moon!!,1619453092.0,2021-04-26 16:04:52,0.0,0.0,1.0,0.0,Neutral
230,"I’m just chillin, hodling and after the MOASS I’m dumping bigly more into doge.",1619453775.0,2021-04-26 16:16:15,-0.3182,0.15,0.85,0.0,Negative
231,**~COME ALONG AND RIDE ON A DOGE-TASTIC VOYAGE!~**,1619453884.0,2021-04-26 16:18:04,0.0,0.0,1.0,0.0,Neutral
232,"Everything dropping, Hodl",1619454164.0,2021-04-26 16:22:44,0.0,0.0,1.0,0.0,Neutral
233,"https://www.instagram.com/reel/CNp8WccpvT6/?igshid=1ej4a7uqon9kk

Elon on Doge. For anyone that missed it. To the moon fellow holders 🚀",1619457934.0,2021-04-26 17:25:34,-0.296,0.136,0.864,0.0,Negative
234,"Hey Shibes, so it occurs to me that businesses accepting Dogecoin need to be able to turn to their suppliers and have them accept it.

Here is a petition for Sysco Foods to accept Dogecoin. This will help hotels, bars, pubs, etc. Many companies get their dry goods, produce, meats, laundry items, etc through Sysco.

Petition for Sysco to Accept Dogecoin:

http://chng.it/zx5DypmgBB

If anyone else feels inclined, maybe create a petition for W.B Mason so that offices can get supplies? Staples, Office Max, etc.",1619460083.0,2021-04-26 18:01:23,0.9217,0.0,0.837,0.163,Positive
235,Elon is my crypto daddy,1619463106.0,2021-04-26 18:51:46,0.0,0.0,1.0,0.0,Neutral
236,What's your average? Mines pretty high @ .32 but all doges go to heaven right!?,1619463965.0,2021-04-26 19:06:05,0.8021,0.0,0.644,0.356,Positive
237,Every Doge has his day...,1619464510.0,2021-04-26 19:15:10,0.0,0.0,1.0,0.0,Neutral
238,Mavs did 6k Doge transactions in April? Wow...like Much Wow!,1619466695.0,2021-04-26 19:51:35,0.6239,0.0,0.687,0.313,Positive
239,"I see DOGE tried to break out of 28 earlier but got pushed back.

Let's hit it again!",1619467120.0,2021-04-26 19:58:40,0.0,0.0,1.0,0.0,Neutral
240,OKcoin has dogecoin available for trading and opens today at 8 pm PT,1619467208.0,2021-04-26 20:00:08,0.0,0.0,1.0,0.0,Neutral
241,I love how it takes 3 hours to go from .4 to .18 but 8 years 10 days and 20 seconds to go from .18 to .26,1619467412.0,2021-04-26 20:03:32,0.3818,0.0,0.909,0.091,Positive
242,I just bought more!!! The next level is coming.,1619467511.0,2021-04-26 20:05:11,0.0,0.0,1.0,0.0,Neutral
243,"When are we predicting to surpass the battle of 28 cents??? Also any predictions of what the new floor shall be? 🚀

Is anyone buying the dips if so what is your avg cost?",1619467670.0,2021-04-26 20:07:50,-0.5514,0.097,0.903,0.0,Negative
244,lets keep it above .27,1619468188.0,2021-04-26 20:16:28,0.0,0.0,1.0,0.0,Neutral
245,what a bunch of dingleberried fopdoodles selling there doges over there *smh*,1619468812.0,2021-04-26 20:26:52,-0.3182,0.173,0.827,0.0,Negative
246,"quiet day for volume, but here are some recent-ish big movers today: 

BUY 1,128,906 DOGE @ .267

BUY 663,732 DOGE @ .270

SELL 556,392 DOGE @ .269",1619469004.0,2021-04-26 20:30:04,0.0,0.0,1.0,0.0,Neutral
247,My cats told me to hold and said the floor is about $0.26.,1619469161.0,2021-04-26 20:32:41,0.0,0.0,1.0,0.0,Neutral
248,uphold is a good wallet for my doges???,1619469854.0,2021-04-26 20:44:14,0.533,0.0,0.67,0.33,Positive
249,Buy the dip,1619471204.0,2021-04-26 21:06:44,0.0,0.0,1.0,0.0,Neutral
250,"When we start going up and holding price all these ""sell now it'll drop tonight, buy back the dip"" come out. They just want to try and buy cheaper coins. Burn them, buy and hodl!!!",1619471260.0,2021-04-26 21:07:40,-0.3971,0.08,0.885,0.035,Negative
251,robinhood giving a bonus to those who trade crypto... doge to the moon! 🚀,1619472177.0,2021-04-26 21:22:57,0.7345,0.0,0.66,0.34,Positive
252,Stability looking good. Wanna see boy run around the block a couple times now.,1619473466.0,2021-04-26 21:44:26,0.0,0.163,0.674,0.163,Neutral
253,Been saving a few GME shares for this day to convert into Doges.,1619473800.0,2021-04-26 21:50:00,0.296,0.0,0.845,0.155,Positive
254,"If you’d have an option like what to get - lambo or tesla, which color lambo you’d chose?",1619473895.0,2021-04-26 21:51:35,0.3612,0.0,0.872,0.128,Positive
255,"##BOO!!! 

Sorry, just trying to get Doge's heart rate up a little.",1619476641.0,2021-04-26 22:37:21,0.6981,0.079,0.611,0.31,Positive
256,It’d be cool if it broke through .28 instead of teasing us,1619478279.0,2021-04-26 23:04:39,-0.2023,0.266,0.584,0.149,Negative
257,Mark Cuban! 🔥🔥🔥,1619478296.0,2021-04-26 23:04:56,-0.7574,0.789,0.211,0.0,Negative
258,We’re through 0.27,1619478528.0,2021-04-26 23:08:48,0.0,0.0,1.0,0.0,Neutral
259,"Stop worrying guys and gals the Doge is very healthy, heartbeat like a champ",1619479317.0,2021-04-26 23:21:57,0.6436,0.205,0.401,0.394,Positive
260,"there's not even any resistance left at 27, volume is just low. the next real resistance is 28.",1619479366.0,2021-04-26 23:22:46,-0.2732,0.11,0.89,0.0,Negative
261,"https://www.google.com/amp/s/www.fool.com/the-ascent/amp/buying-stocks/articles/robinhood-plans-to-launch-a-crypto-wallet-as-fast-as-possible/ 

For all the RH users",1619479663.0,2021-04-26 23:27:43,0.0,0.0,1.0,0.0,Neutral
262,Will it reach .30 today? I guess yes,1619480279.0,2021-04-26 23:37:59,0.4215,0.0,0.612,0.388,Positive
263,"Hopefully marks and Ellen's talk tomorrow increases investors awareness , that's alot of eyes to bring over to doge 💸🤑",1619480889.0,2021-04-26 23:48:09,0.4019,0.0,0.895,0.105,Positive
264,Turn on the rocket engine,1619480972.0,2021-04-26 23:49:32,0.0,0.0,1.0,0.0,Neutral
265,28 sell wall is the real boss fight rn,1619480983.0,2021-04-26 23:49:43,-0.3818,0.245,0.755,0.0,Negative
266,"Cuban Smuban

Wake me up when it's 25$ a pup",1619482058.0,2021-04-27 00:07:38,0.0,0.0,1.0,0.0,Neutral
267,"I wish I never dumped the $14K in the 30s cents range when my $600 bucks bought me 50% of the amount of dogecoins without spending the $14K. 

Now this regret can turn out to be a blessing if doge shoots upto a $1 otherwise I'm not gonna sell it.",1619483628.0,2021-04-27 00:33:48,0.6004,0.057,0.801,0.142,Positive
268,Is 587 Dogecoins good? Idk man I want to buy more,1619483731.0,2021-04-27 00:35:31,0.4215,0.103,0.588,0.309,Positive
269,"Elon Musk is very important in getting Doge to the moon, but Mark Cuban maybe just as important. He too has the connections in tech. He also has connections in sports and retail. If you think Doge will fail or won't take off, think about the support it has backing it.",1619483975.0,2021-04-27 00:39:35,0.177,0.08,0.777,0.143,Positive
270,"big movers: 

BUY: 1,004,153 DOGE @ .266

BUY: 1,653,300 DOGE @ .267

BUY: 594,754 DOGE @ .266",1619484423.0,2021-04-27 00:47:03,0.0,0.0,1.0,0.0,Neutral
271,"fellow hodl'rs, keep the faith!",1619485299.0,2021-04-27 01:01:39,0.4753,0.0,0.564,0.436,Positive
272,Paper hands won't be allowed on my yacht.,1619486071.0,2021-04-27 01:14:31,0.0,0.0,1.0,0.0,Neutral
273,excited for moon,1619486296.0,2021-04-27 01:18:16,0.34,0.0,0.455,0.545,Positive
274,"Let’s have a good week of no panicking, buying dips and supporting one another during a healthy and inevitable rise! 🐶🚀",1619433451.0,2021-04-26 10:37:31,0.8806,0.0,0.629,0.371,Positive
275,"Just a call out / view from my perspective as a business owner.

We all know the value in Doge is not in holding, we hear the negatives that because there’s no  cap etc etc ... 

True value is turning this into an actual currency and get more businesses to accept Doge as a payment right ?

The issue I’m seeing is all these “Hold” posts and yet I don’t see anyone promoting to use their Doge and support businesses that accept it.

What advantages is the community giving businesses to accept Doge ? Right now most businesses are just capitalizing on the free advertising it’s giving them, but what about long term?

Most of you might now realize this, but it literally takes 5 min to sign up and accept Doge on Shopify. It would also take the two seconds to turn it off if a business isn’t getting any “extra” incentive to utilize it because it is extra fees especially on Shopify. 

If this community truly wants Doge to succeed then start using it as currency to create growth. 

Holding Doge will not create long term, sustainable growth. Buying merchandise with it will...",1619456808.0,2021-04-26 17:06:48,0.9888,0.017,0.776,0.207,Positive
276,"I think I got a woody when it just went over .270  

..... and Im a girl",1619457827.0,2021-04-26 17:23:47,0.0,0.0,1.0,0.0,Neutral
277,"Man it'd be super cool if we could, ya know, stay above .27.",1619482194.0,2021-04-27 00:09:54,0.7351,0.0,0.64,0.36,Positive
278,"Time to step up Americans! Global peoples currency? not if we're selling! For once in your life, delay the instant gratification!",1619433177.0,2021-04-26 10:32:57,0.2905,0.093,0.767,0.14,Positive
279,"Me as an old grandpa rich off dogecoin. 
My grandson in 40 years: Hey grandad how did you get rich
Me: well you see sonny a gorilla called harambe died in 2016 then procedes to explain meme culture.",1619434761.0,2021-04-26 10:59:21,0.6908,0.077,0.725,0.198,Positive
280,Some of you guys rely too much on Elon we need to bring this coin up ourselves,1619440853.0,2021-04-26 12:40:53,0.0,0.0,1.0,0.0,Neutral
281,"Lol Cramer said CNBC is legitimizing DOGECoin. No, Jim. We are legitimate, you're just taking notice.",1619441836.0,2021-04-26 12:57:16,0.4215,0.0,0.843,0.157,Positive
282,RIP Ms.Sporklin..a true Shibe..tho your in heaven maybe we'll  be able to glimpse you from the moon mam.....Ms.Sporklin was a core creator of Doge Coin,1619449611.0,2021-04-26 15:06:51,0.7269,0.0,0.79,0.21,Positive
